[
  {
    "id": "saak_milkiya",
    "name_ar": "صك الملكية",
    "name_en": "Title Deed",
    "category": "ملكية",
    "definition_ar": "وثيقة رسمية تُصدرها وزارة العدل عبر منظومة التسجيل العيني للعقار (ريدز)، تُثبت ملكية شخص معين لعقار محدد بحدوده ومساحته وموقعه. يُعدّ الصك الحجة القانونية الكاملة على الملكية ولا تُنتزع الملكية إلا بإجراءات قضائية رسمية.",
    "definition_en": "An official document issued by the Ministry of Justice through the REDS system, proving a specific person's ownership of a defined property with its boundaries, area, and location. The title deed is full legal proof of ownership.",
    "source_url": "https://www.rega.gov.sa/ar/services/real-estate-registration",
    "last_verified": "2026-05-21",
    "audience": ["مالك", "مشتري", "بائع", "مستثمر أجنبي"]
  },
  {
    "id": "naql_milkiya",
    "name_ar": "نقل الملكية",
    "name_en": "Ownership Transfer",
    "category": "ملكية",
    "definition_ar": "الإجراء الرسمي الذي ينتقل بموجبه حق الملكية العقارية من البائع إلى المشتري بعد استيفاء شروط العقد وسداد الثمن وتوثيق العقد لدى كاتب العدل وتسجيله في منظومة ريدز. يستلزم سداد ضريبة التصرفات العقارية قبل إتمام النقل.",
    "definition_en": "The formal procedure by which real estate ownership passes from seller to buyer after fulfilling contract conditions, paying the price, notarizing the deed, and registering in REDS. Requires payment of the Real Estate Transaction Tax before completion.",
    "source_url": "https://www.rega.gov.sa/ar/services/real-estate-registration",
    "last_verified": "2026-05-21",
    "audience": ["مالك", "مشتري", "بائع", "وسيط"]
  },
  {
    "id": "reds_registration",
    "name_ar": "منظومة التسجيل العيني للعقار (ريدز)",
    "name_en": "Real Estate Electronic Registration System (REDS)",
    "category": "ملكية",
    "definition_ar": "نظام إلكتروني تشغّله الهيئة العامة للعقار لتوثيق وتسجيل جميع التصرفات العقارية في المملكة، يشمل نقل الملكية والرهون والحجوزات وحقوق الانتفاع. يستهدف تحويل السجل العقاري السعودي إلى نظام رقمي متكامل.",
    "definition_en": "An electronic system operated by REGA for documenting and registering all real estate transactions in the Kingdom, including ownership transfers, mortgages, encumbrances, and usufruct rights. Aims to fully digitize the Saudi property registry.",
    "source_url": "https://www.rega.gov.sa/ar/services/real-estate-registration",
    "last_verified": "2026-05-21",
    "audience": ["مالك", "مشتري", "بائع", "ممول", "وسيط"]
  },
  {
    "id": "farz_aqari",
    "name_ar": "الفرز العقاري",
    "name_en": "Strata / Condominium Registration",
    "category": "ملكية",
    "definition_ar": "إجراء قانوني يُفرز بموجبه المبنى متعدد الوحدات إلى وحدات مستقلة لكل منها صك ملكية مستقل، مع تحديد الحصص في المرافق المشتركة كالمصاعد والمواقف. يُتيح الفرز تداول الوحدات بيعاً وإيجاراً ورهناً بصورة مستقلة.",
    "definition_en": "A legal procedure splitting a multi-unit building into independent units, each with its own title deed, with defined shares in common areas like elevators and parking. Enables individual unit transfer, lease, and mortgage.",
    "source_url": "https://www.rega.gov.sa/ar/services/real-estate-registration",
    "last_verified": "2026-05-21",
    "audience": ["مطور", "مالك", "مشتري"]
  },
  {
    "id": "haq_intifaa",
    "name_ar": "حق الانتفاع",
    "name_en": "Usufruct Right",
    "category": "ملكية",
    "definition_ar": "حق عيني يُخوَّل بموجبه شخص استخدام عقار مملوك لشخص آخر والانتفاع بثماره دون المساس بجوهر الملكية. يُستخدم هذا الحق في بعض العقود الحكومية وعقود المشاركة في المشاريع التطويرية وكذلك في بعض آليات تملك الأجانب.",
    "definition_en": "A real right granting a person the use and fruits of a property owned by another without altering its substance. Used in certain government contracts, development joint ventures, and some foreign ownership mechanisms.",
    "source_url": "https://www.rega.gov.sa/ar/regulations",
    "last_verified": "2026-05-21",
    "audience": ["مستثمر أجنبي", "مطور", "مالك"]
  },
  {
    "id": "rahn_aqari",
    "name_ar": "الرهن العقاري",
    "name_en": "Real Estate Mortgage (Lien)",
    "category": "ملكية",
    "definition_ar": "حق عيني يُقيَّد على العقار لصالح الدائن (جهة التمويل) ضماناً لسداد الدين. يُسجَّل الرهن في منظومة التسجيل العيني للعقار ويحول دون نقل ملكية العقار دون موافقة الدائن المرتهن.",
    "definition_en": "A real right encumbering the property in favor of the creditor (lender) as security for debt repayment. Registered in the REDS system and prevents property transfer without lender consent.",
    "source_url": "https://www.rega.gov.sa/ar/regulations",
    "last_verified": "2026-05-21",
    "audience": ["مالك", "ممول", "مشتري"]
  },
  {
    "id": "mukhatat",
    "name_ar": "المخطط",
    "name_en": "Subdivision Plan / Plat",
    "category": "ملكية",
    "definition_ar": "وثيقة هندسية معتمدة من البلدية تُبيّن تقسيم قطعة أرض إلى أجزاء أصغر (قطع سكنية أو تجارية)، وتحدد الشوارع والأرصفة ومناطق الخدمات. يُستخدم رقم المخطط ورقم القطعة في وصف العقارات ضمن الصكوك الرسمية.",
    "definition_en": "An officially approved engineering document showing the division of a land parcel into smaller lots (residential or commercial) with defined streets, sidewalks, and service areas. The plan number and lot number identify properties in official deeds.",
    "source_url": "https://www.moh.gov.sa/Ministry/About/Pages/default.aspx",
    "last_verified": "2026-05-21",
    "audience": ["مالك", "مطور", "بائع", "مشتري"]
  },
  {
    "id": "tamalluk_ajnabi",
    "name_ar": "تملك الأجانب للعقار",
    "name_en": "Foreign Real Estate Ownership",
    "category": "ملكية",
    "definition_ar": "حق الأشخاص غير السعوديين في امتلاك العقارات في المملكة وفق شروط وقيود محددة بموجب نظام تملك غير السعوديين للعقار. يُسمح للأجانب بالتملك في مناطق جغرافية معينة ولأغراض محددة، ويُحظر التملك في مكة المكرمة والمدينة المنورة بالنسبة لغير المسلمين.",
    "definition_en": "The right of non-Saudi persons to own real estate in the Kingdom under specific conditions and restrictions defined by the Non-Saudi Property Ownership Regulations. Permitted in designated geographic areas and for specified purposes; prohibited in Mecca and Medina for non-Muslims.",
    "source_url": "https://www.rega.gov.sa/ar/regulations",
    "last_verified": "2026-05-21",
    "audience": ["مستثمر أجنبي"]
  },
  {
    "id": "aqd_ijar_sakani",
    "name_ar": "عقد الإيجار السكني",
    "name_en": "Residential Lease Contract",
    "category": "عقود",
    "definition_ar": "عقد إيجار موثَّق عبر منصة إيجار يُنظِّم العلاقة بين المالك والمستأجر في الوحدات السكنية. يجب أن يتضمن بيانات الطرفين ووصف الوحدة والأجرة السنوية ومدة الإيجار وحقوق والتزامات كل طرف وفق نظام الإيجار ولوائحه.",
    "definition_en": "A tenancy contract documented through the Ejar platform governing the relationship between owner and tenant in residential units. Must include both parties' details, unit description, annual rent, lease term, and each party's rights and obligations under the Rental Law.",
    "source_url": "https://www.ejar.sa/ar/services/residential-lease",
    "last_verified": "2026-05-21",
    "audience": ["مستأجر", "مالك"]
  },
  {
    "id": "aqd_ijar_tijari",
    "name_ar": "عقد الإيجار التجاري",
    "name_en": "Commercial Lease Contract",
    "category": "عقود",
    "definition_ar": "عقد مكتوب يُنظِّم استئجار وحدة أو مكتب أو محل تجاري لأغراض غير سكنية. يتضمن عادةً بنوداً خاصة بضمان الدفع وتحسينات المستأجر والتجديد ورسوم الصيانة المشتركة. يُوصى بتوثيقه عبر منصة إيجار.",
    "definition_en": "A written agreement governing the lease of a unit, office, or commercial space for non-residential purposes. Typically includes clauses on payment security, tenant improvements, renewal, and shared maintenance fees. Recommended to be documented via Ejar.",
    "source_url": "https://www.ejar.sa/ar/services/commercial-lease",
    "last_verified": "2026-05-21",
    "audience": ["مستأجر", "مالك", "وسيط"]
  },
  {
    "id": "aqd_bay",
    "name_ar": "عقد البيع العقاري",
    "name_en": "Real Estate Sale Contract",
    "category": "عقود",
    "definition_ar": "عقد موثَّق لدى كاتب العدل يُثبت اتفاق البائع والمشتري على نقل ملكية العقار بثمن محدد. يُعدّ أساس إجراء نقل الملكية في منظومة ريدز وسداد ضريبة التصرفات العقارية لدى هيئة الزكاة والضريبة والجمارك.",
    "definition_en": "A notarized contract establishing the agreement between seller and buyer to transfer property ownership at a defined price. Forms the basis for the ownership transfer process in REDS and payment of the Real Estate Transaction Tax to ZATCA.",
    "source_url": "https://www.rega.gov.sa/ar/services/real-estate-registration",
    "last_verified": "2026-05-21",
    "audience": ["مالك", "مشتري", "بائع", "وسيط"]
  },
  {
    "id": "aqd_bay_ala_al_kharita",
    "name_ar": "عقد البيع على الخارطة",
    "name_en": "Off-Plan Sale Contract",
    "category": "عقود",
    "definition_ar": "عقد بيع وحدة عقارية لم يكتمل بناؤها بعد، ويُبرم بين المطور العقاري المرخَّص في منصة وافي والمشتري. يخضع لنظام التطوير العقاري ويشترط إيداع المدفوعات في حساب الضمان المعتمد من الهيئة العامة للعقار.",
    "definition_en": "A contract for the sale of a real estate unit not yet completed, concluded between a REGA-licensed developer on the Wafi platform and the buyer. Governed by the Real Estate Development Law, requiring payments to be deposited in a REGA-approved escrow account.",
    "source_url": "https://wafi.rega.gov.sa",
    "last_verified": "2026-05-21",
    "audience": ["مشتري", "مطور"]
  },
  {
    "id": "aqd_tatweer",
    "name_ar": "عقد التطوير العقاري",
    "name_en": "Real Estate Development Agreement",
    "category": "عقود",
    "definition_ar": "اتفاقية بين مالك الأرض والمطور العقاري تُحدد نطاق المشروع التطويري والمسؤوليات المالية والجدول الزمني وآليات توزيع العائد. يخضع لرقابة الهيئة العامة للعقار ويجب أن يتضمن آليات حماية المشترين.",